{
  "family": "development-standard",
  "variant": "chinese-maintenance",
  "version": "1.0.0",
  "name": "工具职责与中文维护",
  "description": "用途：中文维护的第一方 Skill 与项目文档。 不适用：修改第三方上游、企业私有接口或任意替代项目治理契约。 这是可选择的行为偏好，不代表普遍最优做法。",
  "scopes": [
    "中文维护的第一方 Skill 与项目文档。"
  ],
  "rules": [
    "om.portable-files@1.0.0",
    "om.rules-tools@1.0.0",
    "om.maintenance-chinese@1.0.0"
  ]
}
