{
  "family": "delivery-standard",
  "variant": "compact-tables",
  "version": "1.0.0",
  "name": "完整交付与简短表格",
  "description": "用途：需要简短表格辅助比较的文件或汇报交付。 不适用：宽表、长文本单元格、移动端横向滚动或禁止表格的载体。 这是可选择的行为偏好，不代表普遍最优做法。",
  "scopes": [
    "需要简短表格辅助比较的文件或汇报交付。"
  ],
  "rules": [
    "om.versioned-files@1.0.0",
    "om.device-readable@1.0.0",
    "om.semantic-wrap@1.0.0",
    "om.editable-diagrams@1.0.0",
    "om.consistent-items@1.0.0",
    "om.report-context@1.0.0",
    "om.report-formats@1.0.0",
    "om.report-review@1.0.0",
    "om.tables-compact@1.0.0"
  ]
}
