{
  "family": "scenario",
  "variant": "reviewed-project",
  "version": "1.0.0",
  "name": "完整分析与项目交付组合",
  "description": "用途：需要完整分析、版本化交付及中文维护的项目任务。 不适用：未选择此偏好的项目；需要专属业务模板的任务。 这是可选择的行为偏好，不代表普遍最优做法。",
  "scopes": [
    "需要完整分析、版本化交付及中文维护的项目任务。"
  ],
  "rules": [
    "om.conclusion-first@1.0.0",
    "om.chinese-response@1.0.0",
    "om.bilingual-terms@1.0.0",
    "om.markdown-structure@1.0.0",
    "om.clean-deliverable@1.0.0",
    "om.concrete-titles@1.0.0",
    "om.response-dense@1.0.0",
    "om.evidence-inference@1.0.0",
    "om.test-evidence@1.0.0",
    "om.calculations@1.0.0",
    "om.complete-options@1.0.0",
    "om.align-requirements@1.0.0",
    "om.batch-questions@1.0.0",
    "om.assumptions-authority@1.0.0",
    "om.solutions-three-level@1.0.0",
    "om.versioned-files@1.0.0",
    "om.device-readable@1.0.0",
    "om.semantic-wrap@1.0.0",
    "om.editable-diagrams@1.0.0",
    "om.consistent-items@1.0.0",
    "om.report-context@1.0.0",
    "om.report-formats@1.0.0",
    "om.report-review@1.0.0",
    "om.tables-list-first@1.0.0",
    "om.portable-files@1.0.0",
    "om.rules-tools@1.0.0",
    "om.maintenance-chinese@1.0.0"
  ]
}
