{
  "family": "response-style",
  "variant": "dense-chinese",
  "version": "1.0.0",
  "name": "中文完整分析",
  "description": "用途：中文沟通与复杂分析的表达。 不适用：非中文输出、已指定其他写作风格的任务。 这是可选择的行为偏好，不代表普遍最优做法。",
  "scopes": [
    "中文沟通与复杂分析的表达。"
  ],
  "rules": [
    "om.conclusion-first@1.0.0",
    "om.chinese-response@1.0.0",
    "om.bilingual-terms@1.0.0",
    "om.markdown-structure@1.0.0",
    "om.clean-deliverable@1.0.0",
    "om.concrete-titles@1.0.0",
    "om.response-dense@1.0.0"
  ]
}
