{
  "family": "delivery-standard",
  "variant": "list-first",
  "version": "1.0.0",
  "name": "完整交付与列表优先",
  "description": "用途：文件、图文及汇报交付。 不适用：已明确采用其他载体规范的交付；企业专属 PPT 或邮件规则。 这是可选择的行为偏好，不代表普遍最优做法。",
  "scopes": [
    "文件、图文及汇报交付。"
  ],
  "rules": [
    "om.versioned-files@1.0.0",
    "om.device-readable@1.0.0",
    "om.semantic-wrap@1.0.0",
    "om.editable-diagrams@1.0.0",
    "om.consistent-items@1.0.0",
    "om.report-context@1.0.0",
    "om.report-formats@1.0.0",
    "om.report-review@1.0.0",
    "om.tables-list-first@1.0.0"
  ]
}
