{
  "family": "development-standard",
  "variant": "project-language",
  "version": "1.0.0",
  "name": "工具职责与项目语言",
  "description": "用途：按项目语言维护第一方 Skill 与文档。 不适用：未经授权的上游改写或缺少语言约定却直接翻译。 这是可选择的行为偏好，不代表普遍最优做法。",
  "scopes": [
    "按项目语言维护第一方 Skill 与文档。"
  ],
  "rules": [
    "om.portable-files@1.0.0",
    "om.rules-tools@1.0.0",
    "om.maintenance-project-language@1.0.0"
  ]
}
